Sheet: Sheet1
A1: Item | B1: Amount | C1: Unit | D1: Calories
A2: Almonds, shelled | B2: 1 | C2: Item | D2: 11
A3: Apple | B3: 1 | C3: Item | D3: 80
A4: Apple juice | B4: 240 | C4: ml | D4: 115
A5: Applesauce | B5: 240 | C5: ml | D5: 105
A6: Apricot | B6: 3 | C6: Item | D6: 50
A7: Artichoke | B7: 1 | C7: Item | D7: 50
A8: Asparagus | B8: 113.4 | C8: g | D8: 20
A9: Avocado | B9: 1 | C9: Item | D9: 305
A10: Bacon | B10: 3 | C10: Strips | D10: 100
A11: Bacon, Canadian | B11: 56.7 | C11: g | D11: 155
A12: Bagel | B12: 1 | C12: Item | D12: 165
A13: Banana | B13: 1 | C13: Item | D13: 105
A14: Barley | B14: 113.4 | C14: g | D14: 390
A15: Beans, kidney | B15: 240 | C15: ml | D15: 230
A16: Beans, lima | B16: 240 | C16: ml | D16: 260
A17: Beans, navy | B17: 240 | C17: ml | D17: 225
A18: Beef chop suey | B18: 240 | C18: ml | D18: 300
A19: Beer | B19: 340.2 | C19: g | D19: 160
A20: Beet greens | B20: 240 | C20: ml | D20: 25
A21: Beets | B21: 113.4 | C21: g | D21: 35
A22: Biscuit | B22: 1 | C22: Item | D22: 90
A23: Blueberries | B23: 240 | C23: ml | D23: 80
A24: Bluefish | B24: 113.4 | C24: g | D24: 130
A25: Bologna | B25: 56.7 | C25: g | D25: 165
A26: Bran flakes | B26: 240 | C26: ml | D26: 105
A27: Brazil nut, shelled | B27: 28.35 | C27: g | D27: 185
A28: Bread crumbs | B28: 240 | C28: ml | D28: 340
A29: Bread, French | B29: 1 | C29: slice | D29: 70
A30: Bread, Italian | B30: 1 | C30: slice | D30: 70
A31: Bread, pita | B31: 1 | C31: slice | D31: 80
A32: Bread, pumpernickel | B32: 1 | C32: slice | D32: 70
A33: Bread, rye | B33: 1 | C33: slice | D33: 50
A34: Bread, white | B34: 1 | C34: slice | D34: 70
A35: Bread, whole wheat | B35: 1 | C35: slice | D35: 60
A36: Broccoli | B36: 113.4 | C36: g | D36: 30
A37: Brussel sprouts | B37: 240 | C37: ml | D37: 50
A38: Cabbage, raw | B38: 240 | C38: ml | D38: 25
A39: Cake, angel food | B39: 1 | C39: slice | D39: 140
A40: Cake, cheese | B40: 1 | C40: slice | D40: 250
A41: Cake, chocolate | B41: 1 | C41: slice | D41: 270
A42: Cake, strawberry short | B42: 1 | C42: slice | D42: 270
A43: Candy, chocolate | B43: 1 | C43: slice | D43: 145
A44: Cantaloupe | B44: 1 | C44: Item | D44: 95
A45: Carrot | B45: 1 | C45: Item | D45: 30
A46: Cashews, raw | B46: = 0.25 * 28.35 -> 7.0875000000000004 | C46: ml | D46: 196
A47: Catsup | B47: 1 | C47: Item | D47: 15
A48: Cauliflower, raw | B48: 240 | C48: ml | D48: 30
A49: Celery | B49: 1 | C49: Item | D49: 5
A50: Cheese cottage | B50: 113.4 | C50: g | D50: 110
A51: Cheese, cheddar | B51: 28.35 | C51: g | D51: 120
A52: Cheese, cottage, skim | B52: 113.4 | C52: g | D52: 90
A53: Cheese, cream | B53: 28.35 | C53: g | D53: 100
A54: Cheese, feta | B54: 28.35 | C54: g | D54: 75
A55: Cheese, process | B55: 28.35 | C55: g | D55: 100
A56: Cheese, ricotta | B56: 240 | C56: ml | D56: 430
A57: Cheese, ricotta, skim | B57: 240 | C57: ml | D57: 340
A58: Cheese, Swiss | B58: 28.35 | C58: g | D58: 105
A59: Cheeseburger | B59: 1 | C59: Item | D59: 300
A60: Cheeseburger, 1/4 lb. | B60: 1 | C60: Item | D60: 525
A61: Cherries | B61: 240 | C61: ml | D61: 90
A62: Chestnuts, shelled | B62: 240 | C62: ml | D62: 350
A63: Chicken breast | B63: = 3 * 28.35 -> 85.050000000000011 | C63: g | D63: 140
A64: Chicken breast, battered | B64: = 4.9 * 28.35 -> 138.91500000000002 | C64: g | D64: 365
A65: Chicken leg | B65: =1.6*28.35 -> 45.360000000000007 | C65: g | D65: 75
A66: Chicken leg, battered | B66: =2.5*28.35 -> 70.875 | C66: g | D66: 195
A67: Chicken liver | B67: 113.4 | C67: g | D67: 185
A68: Chicken pot pie | B68: 113.4 | C68: g | D68: 350
A69: Chicken salad | B69: =1.9*28.35 -> 53.865000000000002 | C69: g | D69: 90
A70: Chickpeas | B70: 240 | C70: ml | D70: 270
A71: Chili con carne | B71: 240 | C71: ml | D71: 340
A72: Clams | B72: 6 | C72: Item | D72: 100
A73: Cocoa | B73: = 8 * 28.35 -> 226.8 | C73: g | D73: 250
A74: Coconut, dried | B74: 240 | C74: ml | D74: 410
A75: Cod fish cakes | B75: 113.4 | C75: g | D75: 185
A76: Coffee, black | B76: = 6 * 28.35 -> 170.10000000000002 | C76: g | D76: 4
A77: Cola | B77: = 12 * 28.35 -> 340.20000000000005 | C77: g | D77: 144
A78: Collard greens | B78: 240 | C78: ml | D78: 25
A79: Cookie, chocolate chip | B79: 1 | C79: Item | D79: 60
A80: Corn flakes | B80: 240 | C80: ml | D80: 100
A81: Corn grits | B81: 240 | C81: ml | D81: 125
A82: Corn, kernels | B82: 240 | C82: ml | D82: 165
A83: Corn, on cob | B83: 1 | C83: Item | D83: 85
A84: Corned beef | B84: 113.4 | C84: g | D84: 250
A85: Crab meat | B85: 113.4 | C85: g | D85: 100
A86: Cream, coffee | B86: 1 | C86: Item | D86: 29
A87: Cream, half & half | B87: 1 | C87: Item | D87: 20
A88: Cream, heavywhip | B88: 1 | C88: Item | D88: 26
A89: Cream, lightwhip | B89: 1 | C89: Item | D89: 22
A90: Cream, sour | B90: 1 | C90: Item | D90: 25
A91: Croutons | B91: 6 | C91: Item | D91: 35
A92: Cucumber | B92: 1 | C92: Item | D92: 15
A93: Dandelion | B93: 113.4 | C93: g | D93: 50
A94: Dates | B94: 10 | C94: Item | D94: 230
A95: Donut, plain | B95: 1 | C95: Item | D95: 190
A96: Dressing, 1000 Island | B96: 1 | C96: Item | D96: 80
A97: Dressing, French | B97: 1 | C97: Item | D97: 65
A98: Dressing, Italian | B98: 1 | C98: Item | D98: 50
A99: Dressing, low-calorie | B99: 1 | C99: Item | D99: 15
A100: Duck. roast | B100: 113.4 | C100: g | D100: 190
A101: Egg | B101: 1 | C101: Item | D101: 80
A102: Egg muffin sandwich | B102: 1 | C102: Item | D102: 280
A103: Egg white | B103: 1 | C103: Item | D103: 15
A104: Egg yolk | B104: 1 | C104: Item | D104: 65
A105: Eggplant | B105: 240 | C105: ml | D105: 25
A106: Endive/Escarole | B106: 240 | C106: ml | D106: 10
A107: Farina | B107: 240 | C107: ml | D107: 100
A108: Filberts, shelled | B108: 28.35 | C108: g | D108: 180
A109: Filet mignon | B109: 113.4 | C109: g | D109: 250
A110: Fish filet sandwich | B110: 1 | C110: Item | D110: 370
A111: Frankfurter | B111: 1 | C111: Item | D111: 180
A112: French toast | B112: 1 | C112: slice | D112: 130
A113: Frozen yogurt | B113: = 0.5 * 28.35 -> 14.175000000000001 | C113: ml | D113: 105
A114: Ginger ale | B114: 340.2 | C114: g | D114: 115
A115: Granola | B115: 240 | C115: ml | D115: 225
A116: Grapefruit | B116: 1 | C116: Item | D116: 80
A117: Grapes, green | B117: 240 | C117: ml | D117: 90
A118: Green beans | B118: 113.4 | C118: g | D118: 40
A119: Ground beef | B119: 113.4 | C119: g | D119: 320
A120: Ham, Virginia | B120: 113.4 | C120: g | D120: 300
A121: Hamburger | B121: 1 | C121: Item | D121: 245
A122: Hamburger, 1/4 lb. | B122: 1 | C122: Item | D122: 445
A123: Hollandaise sauce | B123: 240 | C123: ml | D123: 240
A124: Ice cream, vanilla | B124: = 0.5 * 28.35 -> 14.175000000000001 | C124: ml | D124: 150
A125: Ice milk | B125: = 0.5 * 28.35 -> 14.175000000000001 | C125: ml | D125: 95
A126: Jam | B126: 1 | C126: Item | D126: 55
A127: Kale, raw | B127: 240 | C127: ml | D127: 40
A128: Kiwi | B128: 1 | C128: Item | D128: 45
A129: Lamb chop | B129: 1 | C129: Item | D129: 385
A130: Leeks | B130: = 0.5 * 28.35 -> 14.175000000000001 | C130: ml | D130: 16
A131: Leg of lamb | B131: 113.4 | C131: g | D131: 217
A132: Lentils | B132: 240 | C132: ml | D132: 215
A133: Lettuce, head | B133: 240 | C133: ml | D133: 15
A134: Lettuce, romaine | B134: 113.4 | C134: g | D134: 25
A135: Liver, broiled | B135: 113.4 | C135: g | D135: 290
A136: Lobster meat | B136: 113.4 | C136: g | D136: 111
A137: Macadamias | B137: 28.35 | C137: g | D137: 196
A138: Mango | B138: 113.4 | C138: g | D138: 75
A139: Margarine, regular | B139: 1 | C139: Item | D139: 102
A140: Margarine, whipped | B140: 1 | C140: Item | D140: 68
A141: Mayonnaise | B141: 1 | C141: Item | D141: 100
A142: Melba toast | B142: 1 | C142: Item | D142: 30
A143: Milk, buttermilk | B143: 240 | C143: ml | D143: 100
A144: Milk, skim | B144: 240 | C144: ml | D144: 85
A145: Milk, whole | B145: 240 | C145: ml | D145: 150
A146: Muffin, bran | B146: 1 | C146: Item | D146: 150
A147: Muffin, corn | B147: 1 | C147: Item | D147: 130
A148: Muffin, English | B148: 1 | C148: Item | D148: 150
A149: Mushrooms | B149: 0.5 | C149: ml | D149: 9
A150: Mustard | B150: 1 | C150: Item | D150: 5
A151: Nectarine | B151: 1 | C151: Item | D151: 75
A152: Oatmeal. cooked | B152: 240 | C152: ml | D152: 150
A153: Okra | B153: 100 | C153: g | D153: 31
A154: Omelet, cheese | B154: 1 | C154: Item | D154: 260
A155: Onions, green | B155: 6 | C155: Item | D155: 25
A156: Onions, white, raw | B156: 113.4 | C156: g | D156: 40
A157: Orange | B157: 1 | C157: Item | D157: 70
A158: Orange juice | B158: 240 | C158: ml | D158: 105
A159: Pancake | B159: 1 | C159: Item | D159: 60
A160: Papaya | B160: 113.4 | C160: g | D160: 45
A161: Parsnips | B161: 240 | C161: ml | D161: 95
A162: Pasta & meatballs | B162: 240 | C162: ml | D162: 330
A163: Pasta, cooked | B163: 240 | C163: ml | D163: 190
A164: Peach | B164: 1 | C164: Item | D164: 50
A165: Peanut butter | B165: 1 | C165: Item | D165: 95
A166: Peanuts, shelled | B166: 1 | C166: Item | D166: 160
A167: Pear | B167: 1 | C167: Item | D167: 100
A168: Peas | B168: 240 | C168: ml | D168: 125
A169: Peas, raw | B169: 0.5 | C169: ml | D169: 58
A170: Pecans, halves | B170: 28.35 | C170: g | D170: 190
A171: Pepper, sweet green | B171: 1 | C171: Item | D171: 20
A172: Pepper, sweet red | B172: 1 | C172: Item | D172: 25
A173: Pie, fruit-filled | B173: = 1/8 -> 0.125 | C173: Item | D173: 300
A174: Pie, lemon meringue | B174: = 1/8 -> 0.125 | C174: Item | D174: 275
A175: Pie, pecan | B175: = 1/8 -> 0.125 | C175: Item | D175: 430
A176: Pine nuts | B176: 28.35 | C176: g | D176: 160
A177: Pineapple | B177: 226.8 | C177: g | D177: 60
A178: Pineapple juice | B178: 113.4 | C178: g | D178: 60
A179: Pistachios, shelled | B179: 28.35 | C179: g | D179: 165
A180: Plum | B180: 1 | C180: Item | D180: 30
A181: Popcorn | B181: 240 | C181: ml | D181: 55
A182: Pork chop | B182: 1 | C182: Item | D182: 275
A183: Pork sausage | B183: 28.35 | C183: g | D183: 130
A184: Potato baked | B184: 113.4 | C184: g | D184: 125
A185: Potato chips | B185: 10 | C185: Item | D185: 105
A186: Potato salad | B186: 240 | C186: ml | D186: 360
A187: Potato, french fried | B187: 6 | C187: Item | D187: 100
A188: Potato, mashed | B188: 0.5 | C188: ml | D188: 90
A189: Potato, sweet | B189: 141.75 | C189: g | D189: 200
A190: Prunes | B190: = 2* 28.35 -> 56.7 | C190: g | D190: 130
A191: Pudding, chocolate | B191: = 0.5 * 240 -> 120 | C191: ml | D191: 200
A192: Pudding, custard | B192: 240 | C192: ml | D192: 305
A193: Pumpkin | B193: 240 | C193: ml | D193: 50
A194: Pumpkin seeds | B194: 28.35 | C194: g | D194: 155
A195: Radishes | B195: 4 | C195: Item | D195: 8
A196: Raisins | B196: =0.25 * 240 -> 60 | C196: ml | D196: 120
A197: Raspberries | B197: 240 | C197: ml | D197: 70
A198: Rice cake | B198: 1 | C198: Item | D198: 35
A199: Rice, brown | B199: 0.5 | C199: ml | D199: 110
A200: Rice, white, cooked | B200: 0.5 | C200: ml | D200: 100
A201: Rice, wild | B201: 0.5 | C201: ml | D201: 85
A202: Roast beef | B202: 113.4 | C202: g | D202: 198
A203: Roast beef sandwich | B203: 1 | C203: Item | D203: 345
A204: Roll, hamburger | B204: 1 | C204: Item | D204: 120
A205: Roll, hot dog | B205: 1 | C205: Item | D205: 160
A206: Roll, onion | B206: 1 | C206: Item | D206: 130
A207: Salami | B207: 28.35 | C207: g | D207: 120
A208: Salmon, baked | B208: 85.05 | C208: g | D208: 140
A209: Salmon, smoked | B209: 85.05 | C209: g | D209: 150
A210: Sauerkraut | B210: 240 | C210: ml | D210: 45
A211: Scallops | B211: 113.4 | C211: g | D211: 140
A212: Sesame butter | B212: 1 | C212: Item | D212: 95
A213: Sesame seeds, hulled | B213: 1 | C213: Item | D213: 45
A214: Shrimp | B214: 85.05 | C214: g | D214: 100
A215: Sirloin steak | B215: 113.4 | C215: g | D215: 229
A216: Soup, chicken noodle | B216: 240 | C216: ml | D216: 75
A217: Soup, clam chowder | B217: 240 | C217: ml | D217: 165
A218: Soup, cream of tomato | B218: 240 | C218: ml | D218: 160
A219: Soup, vegetable beef | B219: 240 | C219: ml | D219: 80
A220: Soybeans | B220: 240 | C220: ml | D220: 235
A221: Spareribs | B221: 6 | C221: Item | D221: 505
A222: Spinach | B222: 240 | C222: ml | D222: 10
A223: Sprouts, alfalfa | B223: 113.4 | C223: g | D223: 32
A224: Sprouts, mung | B224: 113.4 | C224: g | D224: 36
A225: Sprouts, soybean | B225: 113.4 | C225: g | D225: 40
A226: Squash, summer | B226: 0.5 | C226: ml | D226: 55
A227: Squash, winter | B227: 0.5 | C227: ml | D227: 45
A228: Squash, zucchini | B228: 240 | C228: ml | D228: 40
A229: Strawberries | B229: 240 | C229: ml | D229: 55
A230: Sugar | B230: 1 | C230: Item | D230: 45
A231: Sunflower seeds | B231: 28 | C231: Item | D231: 160
A232: Syrup, chocolate | B232: 1 | C232: Item | D232: 47
A233: Syrup, corn/maple | B233: 1 | C233: Item | D233: 60
A234: Taco | B234: 1 | C234: Item | D234: 183
A235: Tangerine | B235: 1 | C235: Item | D235: 37
A236: Tea, black | B236: 226.8 | C236: g | D236: 1
A237: Tofu, raw | B237: 0.5 | C237: ml | D237: 94
A238: Tomato | B238: 1 | C238: Item | D238: 20
A239: Tomato juice | B239: 170.1 | C239: g | D239: 35
A240: Tuna salad | B240: 53.87 | C240: g | D240: 80
A241: Tuna, in oil | B241: 85.05 | C241: g | D241: 165
A242: Tuna, in water | B242: 85.05 | C242: g | D242: 135
A243: Turkey, dark meat | B243: 113.4 | C243: g | D243: 320
A244: Turkey, white meat | B244: 113.4 | C244: g | D244: 200
A245: Turnip greens | B245: 240 | C245: ml | D245: 45
A246: Turnips | B246: 240 | C246: ml | D246: 55
A247: Veal chop | B247: 1 | C247: Item | D247: 260
A248: Vegetable oil | B248: 1 | C248: Item | D248: 120
A249: Vegetable shortening | B249: 1 | C249: Item | D249: 110
A250: Walnut pieces | B250: 1 | C250: Item | D250: 180
A251: Watercress | B251: 113.4 | C251: g | D251: 25
A252: Wheat germ | B252: 0.5 | C252: ml | D252: 220
A253: Wheat, cream of | B253: 0.5 | C253: ml | D253: 65
A254: Wine, dry | B254: 113.4 | C254: g | D254: 100
A255: Wine, sweet | B255: 113.4 | C255: g | D255: 160
A256: Yogurt, fruit-flavor | B256: 240 | C256: ml | D256: 230
A257: Yogurt, low-fat | B257: 240 | C257: ml | D257: 127
A258: Yogurt, whole | B258: 240 | C258: ml | D258: 140